{
  "schema_version": 2,
  "default_integration": {
    "policy": "pinned",
    "key": null,
    "allow_change": false
  },
  "onboarding": {
    "requires_current_user_approval": true,
    "allow_unsafe_multi_install": false
  },
  "generic": {
    "policy": "deny",
    "maximum_bindings": 1
  },
  "catalogs": {
    "allowed_sources": []
  },
  "context": {
    "default_delivery_mode": "loader",
    "allow_materialized_after_loader_failure": true
  },
  "documentation": {
    "language_tag": null,
    "selection_source": null,
    "scope": "new-and-substantively-rewritten-project-documentation"
  },
  "upgrade": {
    "review_mode": "automatic-reference-upgrade"
  },
  "quality_gates": {
    "clarify": "risk-triggered",
    "checklist": "risk-triggered",
    "analyze": "risk-triggered",
    "validate": "required",
    "converge": "required"
  },
  "workflow_governance": {
    "mode": "upstream-adaptive",
    "discovery": "risk-based"
  }
}
